{
  "$ref": "#/definitions/plans",
  "definitions": {
    "plans": {
      "type": "object",
      "properties": {
        "id": {
          "type": "string"
        },
        "order": {
          "type": "integer"
        },
        "price": {
          "type": "object",
          "properties": {
            "monthly": {
              "type": "number"
            },
            "currency": {
              "type": "string"
            }
          },
          "required": [
            "monthly",
            "currency"
          ],
          "additionalProperties": false
        },
        "highlighted": {
          "type": "boolean",
          "default": false
        },
        "copy": {
          "type": "object",
          "additionalProperties": {
            "type": "object",
            "properties": {
              "name": {
                "type": "string"
              },
              "blurb": {
                "type": "string"
              },
              "cta": {
                "type": "string"
              },
              "features": {
                "type": "array",
                "items": {
                  "type": "string"
                }
              }
            },
            "required": [
              "name",
              "blurb",
              "cta",
              "features"
            ],
            "additionalProperties": false
          },
          "propertyNames": {
            "enum": [
              "pt",
              "en"
            ]
          }
        },
        "$schema": {
          "type": "string"
        }
      },
      "required": [
        "id",
        "order",
        "price",
        "copy"
      ],
      "additionalProperties": false
    }
  },
  "$schema": "http://json-schema.org/draft-07/schema#"
}